<?xml version="1.0" encoding="utf-8"?>
<TileDataList xmlns:xsd="http://www.w3.org/2001/XMLSchema" xmlns:xsi="http://www.w3.org/2001/XMLSchema-instance" xsi:noNamespaceSchemaLocation="Tiles.xsd">
    <Tile name="Awful Valley" id="AV" type="V">
        <NormalSide>
            <Clearings>
                <Clearing number="1" type="W"/>
                <Clearing number="2" type="W"/>
                <Clearing number="4" type="W"/>
                <Clearing number="5" type="W"/>
            </Clearings>
            <Paths>
                <Path type="Road" node1="1" node2="NW"/>
                <Path type="Road" node1="1" node2="4"/>
                <Path type="Road" node1="2" node2="SW"/>
                <Path type="Road" node1="2" node2="5"/>
                <Path type="Road" node1="4" node2="NE"/>
                <Path type="Road" node1="4" node2="SE"/>
                <Path type="Road" node1="1" node2="N"/>
            </Paths>
        </NormalSide>
    </Tile>
    <Tile name="Bad Valley" id="BV" type="V">
        <NormalSide>
            <Clearings>
                <Clearing number="1" type="W"/>
                <Clearing number="2" type="W"/>
                <Clearing number="4" type="W"/>
                <Clearing number="5" type="W"/>
            </Clearings>
            <Paths>
                <Path type="Road" node1="1" node2="4"/>
                <Path type="Road" node1="1" node2="SE"/>
                <Path type="Road" node1="2" node2="SW"/>
                <Path type="Road" node1="2" node2="5"/>
                <Path type="Road" node1="4" node2="NW"/>
                <Path type="Road" node1="4" node2="N"/>
                <Path type="Road" node1="5" node2="NE"/>
            </Paths>
        </NormalSide>
    </Tile>
    <Tile name="Border Land" id="BL" type="C">
        <NormalSide>
            <Clearings>
                <Clearing number="1" type="W"/>
                <Clearing number="2" type="W"/>
                <Clearing number="3" type="W"/>
                <Clearing number="4" type="C"/>
                <Clearing number="5" type="C"/>
                <Clearing number="6" type="C"/>
            </Clearings>
            <Paths>
                <Path type="Road" node1="1" node2="SW"/>
                <Path type="Road" node1="1" node2="N"/>
                <Path type="Road" node1="1" node2="6"/>
                <Path type="Road" node1="2" node2="NE"/>
                <Path type="Road" node1="2" node2="S"/>
                <Path type="Road" node1="2" node2="3"/>
                <Path type="Road" node1="3" node2="5"/>
                <Path type="Road" node1="3" node2="6"/>
                <Path type="Tunnel" node1="4" node2="SE"/>
                <Path type="Secret" node1="4" node2="5"/>
                <Path type="Tunnel" node1="4" node2="6"/>
                <Path type="Tunnel" node1="5" node2="NW"/>
            </Paths>
        </NormalSide>
    </Tile>
    <Tile name="Cavern" id="CA" type="C">
        <NormalSide>
            <Clearings>
                <Clearing number="1" type="C"/>
                <Clearing number="2" type="C"/>
                <Clearing number="3" type="C"/>
                <Clearing number="4" type="C"/>
                <Clearing number="5" type="C"/>
                <Clearing number="6" type="C"/>
            </Clearings>
            <Paths>
                <Path type="Road" node1="1" node2="NE"/>
                <Path type="Tunnel" node1="1" node2="3"/>
                <Path type="Secret" node1="1" node2="4"/>
                <Path type="Road" node1="2" node2="N"/>
                <Path type="Tunnel" node1="2" node2="3"/>
                <Path type="Secret" node1="3" node2="5"/>
                <Path type="Tunnel" node1="3" node2="6"/>
                <Path type="Tunnel" node1="4" node2="5"/>
                <Path type="Tunnel" node1="4" node2="6"/>
                <Path type="Road" node1="5" node2="NW"/>
            </Paths>
        </NormalSide>
    </Tile>
    <Tile name="Caves" id="CS" type="C">
        <NormalSide>
            <Clearings>
                <Clearing number="1" type="C"/>
                <Clearing number="2" type="C"/>
                <Clearing number="3" type="C"/>
                <Clearing number="4" type="C"/>
                <Clearing number="5" type="C"/>
                <Clearing number="6" type="C"/>
            </Clearings>
            <Paths>
                <Path type="Road" node1="1" node2="SE"/>
                <Path type="Tunnel" node1="1" node2="6"/>
                <Path type="Road" node1="2" node2="SW"/>
                <Path type="Secret" node1="2" node2="3"/>
                <Path type="Tunnel" node1="2" node2="4"/>
                <Path type="Tunnel" node1="3" node2="5"/>
                <Path type="Tunnel" node1="4" node2="6"/>
                <Path type="Road" node1="5" node2="NW"/>
            </Paths>
        </NormalSide>
    </Tile>
    <Tile name="Crag" id="CR" type="M">
        <NormalSide>
            <Clearings>
                <Clearing number="1" type="M"/>
                <Clearing number="2" type="M"/>
                <Clearing number="3" type="M"/>
                <Clearing number="4" type="M"/>
                <Clearing number="5" type="M"/>
                <Clearing number="6" type="M"/>
            </Clearings>
            <Paths>
                <Path type="Road" node1="1" node2="4"/>
                <Path type="Secret" node1="1" node2="6"/>
                <Path type="Road" node1="2" node2="N"/>
                <Path type="Hidden" node1="2" node2="3"/>
                <Path type="Road" node1="2" node2="5"/>
                <Path type="Road" node1="3" node2="5"/>
                <Path type="Road" node1="3" node2="6"/>
                <Path type="Road" node1="4" node2="6"/>
            </Paths>
        </NormalSide>
    </Tile>
    <Tile name="Cliff" id="CL" type="M">
        <NormalSide>
            <Clearings>
                <Clearing number="1" type="M"/>
                <Clearing number="2" type="W"/>
                <Clearing number="3" type="W"/>
                <Clearing number="4" type="M"/>
                <Clearing number="5" type="W"/>
                <Clearing number="6" type="M"/>
            </Clearings>
            <Paths>
                <Path type="Road" node1="1" node2="NW"/>
                <Path type="Road" node1="1" node2="6"/>
                <Path type="Road" node1="2" node2="SW"/>
                <Path type="Road" node1="2" node2="3"/>
                <Path type="Hidden" node1="2" node2="5"/>
                <Path type="Road" node1="3" node2="5"/>
                <Path type="Secret" node1="3" node2="6"/>
                <Path type="Road" node1="4" node2="NE"/>
                <Path type="Road" node1="4" node2="6"/>
                <Path type="Road" node1="5" node2="SE"/>
            </Paths>
        </NormalSide>
    </Tile>
    <Tile name="Curst Valley" id="CV" type="V">
        <NormalSide>
            <Clearings>
                <Clearing number="1" type="W"/>
                <Clearing number="2" type="W"/>
                <Clearing number="4" type="W"/>
                <Clearing number="5" type="W"/>
            </Clearings>
            <Paths>
                <Path type="Road" node1="1" node2="N"/>
                <Path type="Road" node1="1" node2="4"/>
                <Path type="Road" node1="2" node2="NW"/>
                <Path type="Road" node1="2" node2="5"/>
                <Path type="Road" node1="4" node2="SW"/>
                <Path type="Road" node1="4" node2="SE"/>
                <Path type="Road" node1="5" node2="NE"/>
            </Paths>
        </NormalSide>
    </Tile>
    <Tile name="Dark Valley" id="DV" type="V">
        <NormalSide>
            <Clearings>
                <Clearing number="1" type="W"/>
                <Clearing number="2" type="W"/>
                <Clearing number="4" type="W"/>
                <Clearing number="5" type="W"/>
            </Clearings>
            <Paths>
                <Path type="Road" node1="1" node2="NE"/>
                <Path type="Road" node1="1" node2="4"/>
                <Path type="Road" node1="2" node2="N"/>
                <Path type="Road" node1="2" node2="5"/>
                <Path type="Road" node1="4" node2="SW"/>
                <Path type="Road" node1="4" node2="NW"/>
                <Path type="Road" node1="5" node2="SE"/>
            </Paths>
        </NormalSide>
    </Tile>
    <Tile name="Deep Woods" id="DW" type="M">
        <NormalSide>
            <Clearings>
                <Clearing number="1" type="W"/>
                <Clearing number="2" type="W"/>
                <Clearing number="3" type="W"/>
                <Clearing number="4" type="W"/>
                <Clearing number="5" type="W"/>
                <Clearing number="6" type="W"/>
            </Clearings>
            <Paths>
                <Path type="Road" node1="1" node2="NW"/>
                <Path type="Road" node1="1" node2="N"/>
                <Path type="Hidden" node1="1" node2="4"/>
                <Path type="Road" node1="1" node2="6"/>
                <Path type="Road" node1="2" node2="NE"/>
                <Path type="Road" node1="2" node2="SE"/>
                <Path type="Road" node1="2" node2="3"/>
                <Path type="Road" node1="3" node2="5"/>
                <Path type="Hidden" node1="3" node2="6"/>
                <Path type="Road" node1="4" node2="5"/>
                <Path type="Road" node1="4" node2="6"/>
                <Path type="Road" node1="5" node2="SW"/>
            </Paths>
        </NormalSide>
    </Tile>
    <Tile name="Evil Valley" id="EV" type="V">
        <NormalSide>
            <Clearings>
                <Clearing number="1" type="W"/>